"ProductID","ProductName","Description","Price","Category","Brand","Weight","Flavor","Grain","Material","Color","SubCategory"
"1594","K9 Ballistics Tough Orthopedic XX‑Large Bolster Dog Bed","XXL orthopedic bed with tear‑resistant ripstop cover and foam mattress (for very large dogs)","359.0000","Pet Comfort","K9 Ballistics","0.0000",NULL,"0","foam, ballistic fabric","gray","Dog Bed"
"1595","Bully Beds Chew Resistant Memory Foam Dog Bed - Large","Orthopedic memory‑foam bed with chew‑resistant cover and washable liner","149.9900","Pet Comfort","Bully Beds","0.0000",NULL,"0","memory foam, ripstop cover","navy","Dog Bed"
"1596","Bully Beds Chew Resistant Memory Foam Dog Bed - XL","Extra‑large memory‑foam bed with chew‑resistant cover, for giant breeds","179.9900","Pet Comfort","Bully Beds","0.0000",NULL,"0","memory foam, ripstop cover","charcoal","Dog Bed"
"1597","Bedsure Large Reversible Pillow Dog Bed","Pillow‑style bed with egg‑crate foam, reversible cover (fleece & oxford fabric), machine‑washable","49.9900","Pet Comfort","Bedsure","0.0000",NULL,"0","foam, oxford fabric, fleece","gray","Dog Bed"
"1598","Bedsure X‑Large Reversible Pillow Dog Bed","XL reversible pillow bed for large dogs, washable cover, removable","69.9900","Pet Comfort","Bedsure","0.0000",NULL,"0","foam, oxford fabric, fleece","charcoal","Dog Bed"
"1599","Bedsure Quilted & Washable Orthopedic Dog Bed - Large","Quilted orthopedic bed with washable cover, egg‑crate foam base","59.9900","Pet Comfort","Bedsure","0.0000",NULL,"0","foam, quilted fabric","taupe","Dog Bed"
"1600","Orvis ToughChew Outdoor Dog Bed - Medium","Outdoor‑ready dog bed with water‑resistant/ ripstop cover and dual‑layer foam base","149.0000","Pet Comfort","Orvis","0.0000",NULL,"0","foam, ripstop fabric","khaki","Dog Bed"
"1601","Orvis ToughChew Outdoor Dog Bed - Large","Durable outdoor bed with waterproof/rip‑stop cover, suitable for large/active dogs","179.0000","Pet Comfort","Orvis","0.0000",NULL,"0","foam, ripstop fabric","olive","Dog Bed"
"1602","KOPEKS Orthopedic Memory Foam Dog Bed - Large","Memory‑foam bed with removable, washable cover — supportive and easy to clean","89.9900","Pet Comfort","KOPEKS","0.0000",NULL,"0","memory foam, fabric cover","charcoal","Dog Bed"
"1603","KOPEKS Orthopedic Memory Foam Dog Bed - XL","Extra‑large memory‑foam bed, waterproof liner, supportive padding for big breeds","109.9900","Pet Comfort","KOPEKS","0.0000",NULL,"0","memory foam, waterproof liner, fabric","dark gray","Dog Bed"
"1604","Kuranda Standard Elevated Dog Bed - Medium","Durable PVC elevated bed for indoor/outdoor use, easy‑clean, chew‑resistant","79.9900","Pet Comfort","Kuranda","0.0000",NULL,"0","PVC frame, sling fabric","walnut","Dog Bed"
"1605","Kuranda Standard Elevated Dog Bed - Large","Large PVC‑frame elevated bed for heavy dogs, suitable for crates or outdoor kennels","89.9900","Pet Comfort","Kuranda","0.0000",NULL,"0","PVC frame, sling fabric","walnut","Dog Bed"
"1606","Kuranda Heavy‑Duty Aluminum Dog Bed - Large","Aluminum‑frame elevated bed for large/giant breeds, weather‑resistant, long‑lasting","129.9900","Pet Comfort","Kuranda","0.0000",NULL,"0","aluminum, fabric sling","silver","Dog Bed"
"1607","Sealy Lux Pet Memory Foam Dog Bed - Medium","Memory‑foam mattress‑style bed with comfy support and washable cover","84.9900","Pet Comfort","Sealy","0.0000",NULL,"0","memory foam, fabric cover","gray","Dog Bed"
"1608","Sealy Lux Pet Memory Foam Dog Bed - Large","Large memory‑foam bed for big dogs, supportive mattress‑style","99.9900","Pet Comfort","Sealy","0.0000",NULL,"0","memory foam, fabric cover","charcoal","Dog Bed"
"1609","Milliard Premium Orthopedic Pet Bed - Large","Dual‑layer foam orthopedic bed, waterproof liner, non‑slip bottom","74.9900","Pet Comfort","Milliard","0.0000",NULL,"0","foam, waterproof liner","navy","Dog Bed"
"1610","Milliard Premium Orthopedic Pet Bed - Medium","Orthopedic foam bed for medium dogs, easy‑clean cover","64.9900","Pet Comfort","Milliard","0.0000",NULL,"0","foam, fabric cover","gray","Dog Bed"
"1611","MidWest Homes Double Bolster Pet Bed - Large","Bolstered cushion‑style bed, washable cover, good for medium/large dogs","48.9900","Pet Comfort","MidWest Homes","0.0000",NULL,"0","polyester, cushion fill","beige","Dog Bed"
"1612","MidWest Homes Double Bolster Pet Bed - Jumbo","Oversized bolster bed for larger dogs, cushioned comfort, washable cloth cover","69.9900","Pet Comfort","MidWest Homes","0.0000",NULL,"0","polyester, cushion fill","brown","Dog Bed"
"1613","Coolaroo Original Elevated Dog Bed - Medium","Breathable mesh elevated cot‑style bed, keeps dogs off hot or cold floors","42.0000","Pet Comfort","Coolaroo","0.0000",NULL,"0","metal frame, mesh fabric","green","Dog Bed"
"1614","Coolaroo Original Elevated Dog Bed - Large","Large elevated cot bed, durable mesh, outdoor‑friendly","49.0000","Pet Comfort","Coolaroo","0.0000",NULL,"0","metal frame, mesh fabric","green","Dog Bed"
"1615","MidWest QuietTime MAXX Ultra-Durable Dog Bed - Medium","Durable plush bed, good value bed for everyday indoor use","34.9900","Pet Comfort","MidWest QuietTime","0.0000",NULL,"0","polyester plush","tan","Dog Bed"
"1616","MidWest QuietTime MAXX Ultra-Durable Dog Bed - Large","Large plush padded bed, soft cover and washable","44.9900","Pet Comfort","MidWest QuietTime","0.0000",NULL,"0","polyester plush","chocolate","Dog Bed"
"1617","Serta Orthopedic Dog Bed - Medium","Orthopedic foam bed with quilted top and supportive base, comfy mattress‑style","69.9900","Pet Comfort","Serta","0.0000",NULL,"0","foam, fabric cover","charcoal","Dog Bed"
"1618","Serta Orthopedic Dog Bed - Large","Large orthopedic foam bed for medium/large dogs","79.9900","Pet Comfort","Serta","0.0000",NULL,"0","foam, fabric cover","charcoal","Dog Bed"
"1619","Frisco Plush Bolster Dog Bed - Medium","Bolster‑style plush bed with padded rim for comfort","28.9900","Pet Comfort","Frisco","0.0000",NULL,"0","polyester, foam","brown","Dog Bed"
"1620","Frisco Plush Bolster Dog Bed - Large","Large bolster plush bed for bigger dogs","35.9900","Pet Comfort","Frisco","0.0000",NULL,"0","polyester, foam","navy","Dog Bed"
"1621","Snoozer Luxury Cozy Cave Dog Bed - Small","Cave‑style enclosed bed for small dogs who like burrowing","49.9900","Pet Comfort","Snoozer","0.0000",NULL,"0","plush fabric, padding","navy","Dog Bed"
"1622","Snoozer Luxury Cozy Cave Dog Bed - Medium","Cozy cave bed for small/medium dogs, soft and padded","59.9900","Pet Comfort","Snoozer","0.0000",NULL,"0","plush fabric, padding","olive","Dog Bed"
"1623","Snoozer Luxury Cozy Cave Dog Bed - Large","Large cave‑style bed for medium dogs, warm and cozy","69.9900","Pet Comfort","Snoozer","0.0000",NULL,"0","plush fabric, padding","brown","Dog Bed"
"1624","Kuranda Standard PVC Elevated Dog Bed - Medium","Indoor/Outdoor PVC‑frame elevated bed for dogs up to 100 lb","80.9500","Pet Comfort","Kuranda","0.0000",NULL,"0","PVC frame, sling fabric","almond","Dog Bed"
"1625","Kuranda Standard PVC Elevated Dog Bed - Large","Indoor/Outdoor PVC‑frame elevated bed for larger dogs","95.9500","Pet Comfort","Kuranda","0.0000",NULL,"0","PVC frame, sling fabric","walnut","Dog Bed"
"1626","Kuranda Chew‑Proof Aluminum Elevated Dog Bed - Large","Heavy‑duty aluminum elevated bed, chew‑resistant for tough dogs","136.9500","Pet Comfort","Kuranda","0.0000",NULL,"0","aluminum frame, heavy-duty fabric","silver","Dog Bed"
"1627","Kuranda Slimline Elevated Dog Bed - Medium","Slim PVC elevated bed, easy‑clean, for indoor/outdoor use","109.9500","Pet Comfort","Kuranda","0.0000",NULL,"0","PVC frame, sling fabric","walnut","Dog Bed"
"1628","Kuranda Slimline Elevated Dog Bed - Large","Slim PVC elevated bed, durable for larger breeds","129.9500","Pet Comfort","Kuranda","0.0000",NULL,"0","PVC frame, sling fabric","walnut","Dog Bed"
"1629","Kuranda Crate PVC Dog Bed - Medium","Elevated PVC dog bed sized for medium crates","86.9500","Pet Comfort","Kuranda","0.0000",NULL,"0","PVC frame, sling fabric","almond","Dog Bed"
"1630","Kuranda Crate PVC Dog Bed - Large","Elevated PVC crate‑size bed for large crates","99.9500","Pet Comfort","Kuranda","0.0000",NULL,"0","PVC frame, sling fabric","walnut","Dog Bed"
"1631","Bedsure Orthopedic Waterproof Foam Dog Bed - Medium","Orthopedic foam bed with waterproof removable cover","39.9900","Pet Comfort","Bedsure","0.0000",NULL,"0","foam, waterproof fabric cover","gray","Dog Bed"
"1632","Bedsure Orthopedic Waterproof Foam Dog Bed - Large","Orthopedic foam bed, washable cover, supportive sleep surface","49.9900","Pet Comfort","Bedsure","0.0000",NULL,"0","foam, waterproof fabric cover","charcoal","Dog Bed"
"1633","Bedsure Reversible Pillow Dog Bed - Large","Egg‑crate foam pillow bed, reversible cover: fleece/oxford fabric","59.9900","Pet Comfort","Bedsure","0.0000",NULL,"0","foam, fleece/oxford fabric","taupe","Dog Bed"
"1634","Bully Beds Orthopedic Memory Foam Dog Bed - Large","High‑density memory foam bed with chew‑resistant removable cover","149.9900","Pet Comfort","Bully Beds","0.0000",NULL,"0","memory foam, ripstop cover","navy","Dog Bed"
"1635","Bully Beds Orthopedic Memory Foam Dog Bed - XL","Extra‑large memory foam bed for giant breeds, durable cover","179.9900","Pet Comfort","Bully Beds","0.0000",NULL,"0","memory foam, ripstop cover","charcoal","Dog Bed"
"1636","Milliard Premium Orthopedic Foam Dog Bed - Medium","Dual‑layer foam bed with waterproof liner and non‑slip bottom","64.9900","Pet Comfort","Milliard","0.0000",NULL,"0","foam, waterproof liner, fabric cover","gray","Dog Bed"
"1637","Milliard Premium Orthopedic Foam Dog Bed - Large","Large orthopedic foam bed for medium/large dogs, easy‑clean cover","74.9900","Pet Comfort","Milliard","0.0000",NULL,"0","foam, waterproof liner, fabric cover","navy","Dog Bed"
"1638","MidWest Homes Double Bolster Dog Bed - Large","Bolstered cushion‑style bed, washable removable cover","48.9900","Pet Comfort","MidWest Homes","0.0000",NULL,"0","polyester cushion, fabric cover","beige","Dog Bed"
"1639","MidWest Homes Double Bolster Dog Bed - Jumbo","Oversized bolster bed for very large dogs, cushioned comfort","69.9900","Pet Comfort","MidWest Homes","0.0000",NULL,"0","polyester cushion, fabric cover","brown","Dog Bed"
"1640","Coolaroo Original Elevated Dog Bed - Medium","Breathable mesh elevated cot‑style bed, indoor/outdoor use","42.0000","Pet Comfort","Coolaroo","0.0000",NULL,"0","metal frame, mesh fabric","green","Dog Bed"
"1641","Coolaroo Original Elevated Dog Bed - Large","Large elevated mesh bed, durable for bigger dogs","49.0000","Pet Comfort","Coolaroo","0.0000",NULL,"0","metal frame, mesh fabric","green","Dog Bed"
"1642","Serta Memory Foam Dog Bed - Medium","Mattress‑style memory foam dog bed with supportive base and fabric cover","84.9900","Pet Comfort","Serta","0.0000",NULL,"0","memory foam, fabric cover","gray","Dog Bed"
"1643","Serta Memory Foam Dog Bed - Large","Supportive memory foam bed for large dogs, washable cover","99.9900","Pet Comfort","Serta","0.0000",NULL,"0","memory foam, fabric cover","charcoal","Dog Bed"
"1644","Orvis ToughChew Outdoor Dog Bed - Medium","Outdoor‑ready bed with water‑resistant rip‑stop cover and foam base","149.0000","Pet Comfort","Orvis","0.0000",NULL,"0","foam, rip‑stop fabric","khaki","Dog Bed"
"1645","Orvis ToughChew Outdoor Dog Bed - Large","Heavy‑duty outdoor bed with waterproof/rip‑stop cover, for active dogs","179.0000","Pet Comfort","Orvis","0.0000",NULL,"0","foam, rip‑stop fabric","olive","Dog Bed"
"1646","Frisco Plush Bolster Dog Bed - Medium","Soft bolster‑style bed with padded rim for comfort","28.9900","Pet Comfort","Frisco","0.0000",NULL,"0","polyester, cushion fill","brown","Dog Bed"
"1647","Frisco Plush Bolster Dog Bed - Large","Large bolster plush bed for bigger dogs","35.9900","Pet Comfort","Frisco","0.0000",NULL,"0","polyester, cushion fill","navy","Dog Bed"
"1648","Snoozer Luxury Cozy Cave Dog Bed - Small","Cave‑style enclosed bed for small dogs/puppies who like to burrow","49.9900","Pet Comfort","Snoozer","0.0000",NULL,"0","plush fabric, padding","navy","Dog Bed"
"1649","Snoozer Luxury Cozy Cave Dog Bed - Medium","Cozy cave‑style bed for small/medium dogs","59.9900","Pet Comfort","Snoozer","0.0000",NULL,"0","plush fabric, padding","olive","Dog Bed"
"1650","Snoozer Luxury Cozy Cave Dog Bed - Large","Large cave bed for medium dogs, soft and padded","69.9900","Pet Comfort","Snoozer","0.0000",NULL,"0","plush fabric, padding","brown","Dog Bed"
"1651","FurHaven Plush & Suede Sofa Dog Bed - Small","Orthopedic foam bed with plush/suede cover, bolstered edges","39.9900","Pet Comfort","FurHaven","0.0000",NULL,"0","foam, plush/suede cover","stone gray","Dog Bed"
"1652","FurHaven Plush & Suede Sofa Dog Bed - Medium","Orthopedic foam bed with plush/suede cover","47.9900","Pet Comfort","FurHaven","0.0000",NULL,"0","foam, plush/suede cover","stone gray","Dog Bed"
"1653","FurHaven Plush & Suede Sofa Dog Bed - Large","Bolstered orthopedic sofa bed for larger dogs","59.9900","Pet Comfort","FurHaven","0.0000",NULL,"0","foam, plush/suede cover","espresso","Dog Bed"
"1654","FurHaven Plush & Suede Sofa Dog Bed - Jumbo","Extra‑large orthopedic bed for big/giant breeds, washable cover","79.9900","Pet Comfort","FurHaven","0.0000",NULL,"0","foam, plush/suede cover","navy","Dog Bed"
"1655","PetFusion Ultimate Dog Bed - Jumbo","Memory‑foam orthopedic bed with bolstered sides and removable cover","139.9900","Pet Comfort","PetFusion","0.0000",NULL,"0","memory foam, polyester cover","gray","Dog Bed"
"1656","PetFusion Ultimate Dog Bed - Small","Memory‑foam orthopedic bed with bolstered sides and removable cover","74.9500","Pet Comfort","PetFusion","0.0000",NULL,"0","memory foam, polyester cover","sandstone","Dog Bed"
"1657","PetFusion Ultimate Dog Bed - Large","Memory‑foam orthopedic bed for large dogs, with bolstered rim and non‑slip bottom","109.9900","Pet Comfort","PetFusion","0.0000",NULL,"0","memory foam, polyester cover","slate gray","Dog Bed"
"1658","BarksBar Orthopedic Sofa Dog Bed - Medium","Orthopedic foam bed with cotton‑padded rim, removable washable cover","48.9500","Pet Comfort","BarksBar","0.0000",NULL,"0","orthopedic foam, cotton cover","gray","Dog Bed"
"1659","BarksBar Orthopedic Sofa Dog Bed - Large","Large orthopedic foam bed for medium/large dogs, padded rim","58.9500","Pet Comfort","BarksBar","0.0000",NULL,"0","orthopedic foam, cotton cover","charcoal","Dog Bed"
"1660","Acme Dog Whistle Model 210","Classic dog whistle for training and recall","12.9900","Pet Hardware","Acme","0.0000",NULL,"0","metal","silver","Dog Training Tool"
"1661","SportDOG Trainer Whistle","Adjustable frequency whistle for dogs","19.9500","Pet Hardware","SportDOG","0.0000",NULL,"0","plastic, metal","black","Dog Training Tool"
"1662","Fox 40 Classic Whistle","Professional-grade whistle for dog training and outdoor use","9.9900","Pet Hardware","Fox 40","0.0000",NULL,"0","plastic","orange","Dog Training Tool"
"1663","PetSafe Gentle Whistle","Ultrasonic dog whistle for positive reinforcement training","14.9900","Pet Hardware","PetSafe","0.0000",NULL,"0","plastic, metal","blue","Dog Training Tool"
"1664","Cox Dog Whistle with Lanyard","Traditional metal dog whistle with carrying lanyard","11.9900","Pet Hardware","Cox","0.0000",NULL,"0","metal","silver","Dog Training Tool"
"1665","Andis Pro Grooming Kit","Professional grooming kit with clippers, blades, and accessories","129.9900","Hygiene","Andis","0.0000",NULL,"0","metal, plastic","black","Grooming Kit"
"1666","Wahl Deluxe Pet Grooming Kit","Includes clippers, combs, scissors, and grooming tools","89.9900","Hygiene","Wahl","0.0000",NULL,"0","metal, plastic","silver","Grooming Kit"
"1667","Furminator Grooming Kit","DeShedding tool, comb, nail clippers, and brush for all coat types","59.9900","Hygiene","Furminator","0.0000",NULL,"0","metal, plastic","orange","Grooming Kit"
"1668","Pet Magasin Deluxe Grooming Kit","Complete kit with combs, brushes, nail clippers, and scissors","49.9900","Hygiene","Pet Magasin","0.0000",NULL,"0","metal, plastic","black","Grooming Kit"
"1669","Hertzko Self-Cleaning Slicker Brush & Grooming Kit","Brush and grooming tools for dogs of all sizes","34.9900","Hygiene","Hertzko","0.0000",NULL,"0","metal, plastic","red","Grooming Kit"
"1670","ConairPRO Dog Grooming Kit","Professional grooming kit with clippers and accessories","99.9900","Hygiene","ConairPRO","0.0000",NULL,"0","metal, plastic","black","Grooming Kit"
"1671","PetEdge Complete Grooming Kit","Combs, brushes, nail clippers, and scissors for all coat types","74.9900","Hygiene","PetEdge","0.0000",NULL,"0","metal, plastic","blue","Grooming Kit"
"1672","Paw Brothers Dog Grooming Kit","Multi-tool kit including clippers, scissors, and brushes","54.9900","Hygiene","Paw Brothers","0.0000",NULL,"0","metal, plastic","gray","Grooming Kit"
"1673","Ivory Coat Grooming Kit","Kit with brushes, slickers, and combs for medium to large dogs","44.9900","Hygiene","Ivory Coat","0.0000",NULL,"0","metal, plastic","purple","Grooming Kit"
"1674","Safari Professional Grooming Kit","Grooming kit with professional quality tools for dogs","109.9900","Hygiene","Safari","0.0000",NULL,"0","metal, plastic","black","Grooming Kit"
"1675","Chris Christensen Grooming Kit","Premium grooming kit with combs, brushes, and scissors","199.9900","Hygiene","Chris Christensen","0.0000",NULL,"0","metal, plastic","silver","Grooming Kit"
"1676","Booda Grooming Kit","Brushes, combs, and nail tools for small to medium dogs","39.9900","Hygiene","Booda","0.0000",NULL,"0","metal, plastic","green","Grooming Kit"
"1677","PetFusion Grooming Kit","De-shedding brush, combs, and nail clippers included","59.9900","Hygiene","PetFusion","0.0000",NULL,"0","metal, plastic","black","Grooming Kit"
"1678","Pet Neat Grooming Kit","Complete grooming set with clippers, brushes, and scissors","49.9900","Hygiene","Pet Neat","0.0000",NULL,"0","metal, plastic","red","Grooming Kit"
"1679","Arf Pets Dog Grooming Kit","Multi-tool grooming kit for dogs and cats","34.9900","Hygiene","Arf Pets","0.0000",NULL,"0","metal, plastic","blue","Grooming Kit"
"1680","Andis EasyClip Pro Grooming Kit","Cordless clippers, blades, and accessories","139.9900","Hygiene","Andis","0.0000",NULL,"0","metal, plastic","black","Grooming Kit"
"1681","Wahl Pet-Pro Grooming Kit","Cordless grooming kit with multiple attachments","119.9900","Hygiene","Wahl","0.0000",NULL,"0","metal, plastic","silver","Grooming Kit"
"1682","Furminator Deshedding Grooming Kit","Slicker brush, de-shedding tool, comb, and nail clippers","69.9900","Hygiene","Furminator","0.0000",NULL,"0","metal, plastic","orange","Grooming Kit"
"1683","Paws & Pals Grooming Kit","Professional-grade clippers, scissors, and brushes","79.9900","Hygiene","Paws & Pals","0.0000",NULL,"0","metal, plastic","black","Grooming Kit"
"1684","PetStyle Grooming Kit","All-in-one grooming kit for dogs of all sizes","64.9900","Hygiene","PetStyle","0.0000",NULL,"0","metal, plastic","pink","Grooming Kit"
"1685","Oster Pro Pet Grooming Kit","Premium clippers with combs, brushes, and scissors","129.9900","Hygiene","Oster","0.0000",NULL,"0","metal, plastic","silver","Grooming Kit"
"1686","Bissell Pet Grooming Kit","Includes comb, nail clippers, and multiple brushes","54.9900","Hygiene","Bissell","0.0000",NULL,"0","metal, plastic","blue","Grooming Kit"
"1687","Pet Republique Grooming Kit","Professional dog grooming kit with clippers and accessories","89.9900","Hygiene","Pet Republique","0.0000",NULL,"0","metal, plastic","black","Grooming Kit"
"1688","Shernbao Professional Grooming Kit","High-quality grooming kit with scissors, combs, and clippers","149.9900","Hygiene","Shernbao","0.0000",NULL,"0","metal, plastic","gray","Grooming Kit"
"1689","Hertzko All-in-One Grooming Kit","Brushes, combs, and nail clippers for dogs","39.9900","Hygiene","Hertzko","0.0000",NULL,"0","metal, plastic","red","Grooming Kit"
"1690","FURminator Dog Comb","Stainless steel comb for detangling and grooming","14.9900","Hygiene","FURminator","0.0000",NULL,"0","metal, plastic","silver","Comb"
"1691","Hertzko Dog Comb","Professional stainless steel grooming comb for dogs","12.9900","Hygiene","Hertzko","0.0000",NULL,"0","metal, plastic","black","Comb"
"1692","Andis Pet Comb","Double-sided metal comb for dogs and cats","9.9900","Hygiene","Andis","0.0000",NULL,"0","metal","silver","Comb"
"1693","Safari Professional Dog Comb","Premium grooming comb for all coat types","15.9900","Hygiene","Safari","0.0000",NULL,"0","metal, plastic","black","Comb"
"1694","Chris Christensen Comb","High-quality stainless steel comb for show dogs","22.9900","Hygiene","Chris Christensen","0.0000",NULL,"0","metal","silver","Comb"
"1695","Bodhi Dog Comb","Durable stainless steel comb for long and short hair","11.9900","Hygiene","Bodhi","0.0000",NULL,"0","metal, plastic","blue","Comb"
"1696","JW Pet GripSoft Comb","Comfort grip grooming comb for pets","13.9900","Hygiene","JW Pet","0.0000",NULL,"0","metal, rubber","black","Comb"
"1697","Pet Neat Stainless Steel Comb","Professional comb for dogs and puppies","10.9900","Hygiene","Pet Neat","0.0000",NULL,"0","metal","silver","Comb"
"1698","Shernbao Dog Comb","High-quality comb for detangling and finishing","19.9900","Hygiene","Shernbao","0.0000",NULL,"0","metal","black","Comb"
"1699","Paw Brothers Grooming Comb","Durable stainless steel dog comb","12.4900","Hygiene","Paw Brothers","0.0000",NULL,"0","metal","silver","Comb"
"1700","Ivory Coat Dog Comb","Comb for grooming medium and large breeds","14.4900","Hygiene","Ivory Coat","0.0000",NULL,"0","metal","black","Comb"
"1701","Pet Magasin Dog Comb","Grooming comb for all coat types","12.9900","Hygiene","Pet Magasin","0.0000",NULL,"0","metal, plastic","red","Comb"
"1702","Furminator Dematting Comb","Comb designed to reduce matting and tangles","16.9900","Hygiene","Furminator","0.0000",NULL,"0","metal, plastic","orange","Comb"
"1703","Oster Dog Comb","Professional stainless steel dog comb for grooming","18.9900","Hygiene","Oster","0.0000",NULL,"0","metal","silver","Comb"
"1704","Bissell Dog Comb","Multi-purpose stainless steel grooming comb","11.9900","Hygiene","Bissell","0.0000",NULL,"0","metal, plastic","black","Comb"
"1705","Arf Pets Dog Comb","Stainless steel comb with handle for grooming","10.9900","Hygiene","Arf Pets","0.0000",NULL,"0","metal, plastic","blue","Comb"
"1706","PetStyle Dog Comb","Durable double-sided comb for dogs","13.4900","Hygiene","PetStyle","0.0000",NULL,"0","metal, plastic","black","Comb"
"1707","ConairPRO Dog Comb","Professional grooming comb for pets","15.4900","Hygiene","ConairPRO","0.0000",NULL,"0","metal, plastic","silver","Comb"
"1708","PetEdge Dog Comb","Premium stainless steel dog comb for grooming","19.9900","Hygiene","PetEdge","0.0000",NULL,"0","metal","silver","Comb"
"1709","Artero Dog Comb","Professional comb for all coat types","21.9900","Hygiene","Artero","0.0000",NULL,"0","metal","black","Comb"
"1710","Booda Dog Comb","Detangling and grooming comb for small to medium dogs","9.9900","Hygiene","Booda","0.0000",NULL,"0","metal, plastic","green","Comb"
"1711","Safari Mini Dog Comb","Compact stainless steel comb for small breeds","8.9900","Hygiene","Safari","0.0000",NULL,"0","metal","silver","Comb"
"1712","FURminator Long Hair Comb","Comb for long-haired dogs to reduce shedding","17.9900","Hygiene","FURminator","0.0000",NULL,"0","metal, plastic","orange","Comb"
"1713","Chris Christensen Fine Comb","Fine-toothed comb for detailed grooming","24.9900","Hygiene","Chris Christensen","0.0000",NULL,"0","metal","silver","Comb"
"1714","Hertzko Fine Comb","Stainless steel fine comb for all coat types","14.9900","Hygiene","Hertzko","0.0000",NULL,"0","metal","black","Comb"
"1715","JW Pet Professional Comb","High-quality comb for detangling and finishing","16.4900","Hygiene","JW Pet","0.0000",NULL,"0","metal, rubber","blue","Comb"
"1716","Shernbao Fine Comb","Professional fine-tooth comb for show grooming","22.9900","Hygiene","Shernbao","0.0000",NULL,"0","metal","black","Comb"
"1717","Pet Neat Fine Comb","Fine stainless steel comb for detailed grooming","12.9900","Hygiene","Pet Neat","0.0000",NULL,"0","metal","silver","Comb"
"1718","Furminator Short Hair Comb","Comb for short-haired dogs to remove loose hair","15.9900","Hygiene","Furminator","0.0000",NULL,"0","metal, plastic","orange","Comb"
"1719","Pet Magasin Fine Comb","Professional comb for fine grooming tasks","13.9900","Hygiene","Pet Magasin","0.0000",NULL,"0","metal, plastic","red","Comb"
"1720","Ivory Coat Fine Comb","Fine comb for all coat types","16.4900","Hygiene","Ivory Coat","0.0000",NULL,"0","metal","black","Comb"
"1721","Oster Fine Comb","Professional comb for precision grooming","19.9900","Hygiene","Oster","0.0000",NULL,"0","metal","silver","Comb"
"1722","Andis Fine Comb","Fine-toothed comb for small and medium breeds","17.9900","Hygiene","Andis","0.0000",NULL,"0","metal","silver","Comb"
"1723","Bissell Fine Comb","Compact fine comb for grooming dogs","12.9900","Hygiene","Bissell","0.0000",NULL,"0","metal, plastic","black","Comb"
"1724","Arf Pets Fine Comb","High-quality comb for grooming dogs","14.9900","Hygiene","Arf Pets","0.0000",NULL,"0","metal, plastic","blue","Comb"
"1725","PetStyle Fine Comb","Double-sided fine comb for professional grooming","15.9900","Hygiene","PetStyle","0.0000",NULL,"0","metal, plastic","black","Comb"
"1726","ConairPRO Fine Comb","Fine comb for detailed pet grooming","16.9900","Hygiene","ConairPRO","0.0000",NULL,"0","metal, plastic","silver","Comb"
"1727","PetEdge Fine Comb","Stainless steel comb for precise grooming","21.9900","Hygiene","PetEdge","0.0000",NULL,"0","metal","silver","Comb"
