"ProductID","ProductName","Description","Price","Category","Brand","Weight","Flavor","Grain","Material","Color","SubCategory"
"558","Earth Animal No-Hide Pork Chew Medium",NULL,"9.9900","Dog Chew","Earth Animal","0.0000",NULL,"0",NULL,NULL,"Alternative Chew"
"559","Earth Animal No-Hide Pork Chew Large",NULL,"14.9900","Dog Chew","Earth Animal","0.0000",NULL,"0",NULL,NULL,"Alternative Chew"
"560","Good Lovin Collagen Twist 5 inch",NULL,"2.9900","Dog Chew","Good Lovin","0.0000",NULL,"0",NULL,NULL,"Alternative Chew"
"561","Good Lovin Collagen Twist 10 inch",NULL,"4.9900","Dog Chew","Good Lovin","0.0000",NULL,"0",NULL,NULL,"Alternative Chew"
"562","Good Lovin Collagen Ring",NULL,"4.2900","Dog Chew","Good Lovin","0.0000",NULL,"0",NULL,NULL,"Alternative Chew"
"563","Good Lovin Collagen Braid 6 inch",NULL,"5.2900","Dog Chew","Good Lovin","0.0000",NULL,"0",NULL,NULL,"Alternative Chew"
"564","Pet Factory Natural Beefhide Roll 6 inch",NULL,"3.4900","Dog Chew","Pet Factory","0.0000",NULL,"0",NULL,NULL,"Alternative Chew"
"565","Pet Factory Natural Beefhide Roll 15 inch",NULL,"7.9900","Dog Chew","Pet Factory","0.0000",NULL,"0",NULL,NULL,"Alternative Chew"
"566","Pet Factory Beefhide Chips Assorted Flavors",NULL,"5.9900","Dog Chew","Pet Factory","0.0000",NULL,"0",NULL,NULL,"Alternative Chew"
"567","Loving Pets Meat Wrapped Rawhide Alternative Chicken Sticks",NULL,"9.9900","Dog Chew","Loving Pets","0.0000",NULL,"0",NULL,NULL,"Alternative Chew"
"568","Loving Pets Meat Wrapped Rawhide Alternative Duck Sticks",NULL,"10.4900","Dog Chew","Loving Pets","0.0000",NULL,"0",NULL,NULL,"Alternative Chew"
"569","Loving Pets Natural Rawhide Alternative Carrot Wrap",NULL,"7.9900","Dog Chew","Loving Pets","0.0000",NULL,"0",NULL,NULL,"Alternative Chew"
"570","Whimzees Natural Dental Chew Stick Small",NULL,"1.4900","Dog Chew","Whimzees","0.0000",NULL,"0",NULL,NULL,"Alternative Chew"
"571","Whimzees Natural Dental Chew Stick Medium",NULL,"2.4900","Dog Chew","Whimzees","0.0000",NULL,"0",NULL,NULL,"Alternative Chew"
"572","Whimzees Natural Dental Chew Stick Large",NULL,"3.4900","Dog Chew","Whimzees","0.0000",NULL,"0",NULL,NULL,"Alternative Chew"
"573","SmartBones Chicken Chews Mini 8 Pack",NULL,"6.9900","Dog Chew","SmartBones","0.0000",NULL,"0",NULL,NULL,"Alternative Chew"
"574","SmartBones Peanut Butter Chews Mini 8 Pack",NULL,"6.9900","Dog Chew","SmartBones","0.0000",NULL,"0",NULL,NULL,"Alternative Chew"
"575","SmartBones Chicken Chews Medium",NULL,"8.9900","Dog Chew","SmartBones","0.0000",NULL,"0",NULL,NULL,"Alternative Chew"
"576","Nutramax Cosequin DS Plus MSM Joint Supplement Chews",NULL,"36.9900","Dog Supplement","Nutramax","0.0000",NULL,"0",NULL,NULL,"Joint"
"577","Nutramax Dasuquin Joint Supplement Chews",NULL,"59.9900","Dog Supplement","Nutramax","0.0000",NULL,"0",NULL,NULL,"Joint"
"578","VetriScience GlycoFlex 3 Hip & Joint Soft Chews",NULL,"44.9900","Dog Supplement","VetriScience","0.0000",NULL,"0",NULL,NULL,"Joint"
"579","Zesty Paws 11‑in‑1 Multivitamin Bites for Dogs",NULL,"32.9700","Dog Supplement","Zesty Paws","0.0000",NULL,"0",NULL,NULL,"Multivitamin"
"580","PetHonesty 100% Natural Omega‑3 Fish Oil Softgels",NULL,"29.9900","Dog Supplement","PetHonesty","0.0000",NULL,"0",NULL,NULL,"Omegas"
"581","Grizzly Salmon Oil Liquid Supplement for Dogs",NULL,"25.0000","Dog Supplement","Grizzly","0.0000",NULL,"0",NULL,NULL,"Omegas"
"582","Nordic Naturals Omega‑3 Pet Softgels",NULL,"35.9500","Dog Supplement","Nordic Naturals","0.0000",NULL,"0",NULL,NULL,"Omegas"
"583","NaturVet Aller‑Derm Skin & Coat Supplement Chews",NULL,"24.9900","Dog Supplement","NaturVet","0.0000",NULL,"0",NULL,NULL,"Omegas"
"584","PetHonesty Multivitamin & Probiotic Dog Supplement",NULL,"34.9900","Dog Supplement","PetHonesty","0.0000",NULL,"0",NULL,NULL,"Multivitamin"
"585","Health Naturals Green‑Lipped Mussel Joint Support Soft Chews",NULL,"27.9900","Dog Supplement","Health Naturals","0.0000",NULL,"0",NULL,NULL,"Joint"
"586","OmegaPlus Omega 3‑6‑9 Skin & Coat Soft Chews",NULL,"22.9900","Dog Supplement","OmegaPlus","0.0000",NULL,"0",NULL,NULL,"Omegas"
"587","SeniorPetCare Joint & Multivitamin Soft Chews for Senior Dogs",NULL,"39.9900","Dog Supplement","SeniorPetCare","0.0000",NULL,"0",NULL,NULL,"Multivitamin"
"588","DigestPet Probiotic Digestive Support Chews",NULL,"26.9900","Dog Supplement","DigestPet","0.0000",NULL,"0",NULL,NULL,"Probiotic"
"589","AllPetVits Multivitamin & Antioxidant Tablets",NULL,"29.9900","Dog Supplement","AllPetVits","0.0000",NULL,"0",NULL,NULL,"Multivitamin"
"590","FlexCare Glucosamine + Chondroitin + MSM Tablets",NULL,"31.9900","Dog Supplement","FlexCare","0.0000",NULL,"0",NULL,NULL,"Joint"
"591","JointEase Hyaluronic Acid & Joint Lubricant Chews",NULL,"34.9900","Dog Supplement","JointEase","0.0000",NULL,"0",NULL,NULL,"Joint"
"592","CoatCare Vitamin E & Biotin Skin & Coat Soft Chews",NULL,"24.9900","Dog Supplement","CoatCare","0.0000",NULL,"0",NULL,NULL,"Skin and Coat"
"593","BrainPet Omega‑3 / DHA Cognitive Support Soft Chews",NULL,"36.9900","Dog Supplement","BrainPet","0.0000",NULL,"0",NULL,NULL,"Omegas"
"594","ImmuniPets Immune Support Multivitamin Chews",NULL,"23.9900","Dog Supplement","ImmuniPets","0.0000",NULL,"0",NULL,NULL,"Multivitamin"
"595","HipFlex Large Breed Joint & Hip Mobility Chews",NULL,"42.9900","Dog Supplement","HipFlex","0.0000",NULL,"0",NULL,NULL,"Joint"
"596","BoneHealth Calcium & Bone Support Tablets",NULL,"19.9900","Dog Supplement","BoneHealth","0.0000",NULL,"0",NULL,NULL,"Joint"
"597","DentalPet Dental Health Supplement Tablets",NULL,"17.9900","Dog Supplement","DentalPet","0.0000",NULL,"0",NULL,NULL,"Dental"
"598","AllerPet Skin & Allergy Support Soft Chews",NULL,"25.9900","Dog Supplement","AllerPet","0.0000",NULL,"0",NULL,NULL,"Skin and Coat"
"599","GutBalance Probiotic + Prebiotic Gut Health Supplement",NULL,"24.9900","Dog Supplement","GutBalance","0.0000",NULL,"0",NULL,NULL,"Probiotic"
"600","OmegaPure Fish Oil & Omega Skin Extra Strength Liquid",NULL,"30.9900","Dog Supplement","OmegaPure","0.0000",NULL,"0",NULL,NULL,"Omegas"
"601","JointMax Glucosamine + Green‑Lipped Mussel Support Chews",NULL,"33.9900","Dog Supplement","JointMax","0.0000",NULL,"0",NULL,NULL,"Joint"
"602","VitaOmega Multivitamin + Omega Combo Soft Chews",NULL,"29.4900","Dog Supplement","VitaOmega","0.0000",NULL,"0",NULL,NULL,"Multivitamin"
"603","CalmPaws Calming & Stress Relief Soft Chews (Melatonin + Herbs)",NULL,"21.9900","Dog Supplement","CalmPaws","0.0000",NULL,"0",NULL,NULL,"Calming"
"604","Pet Naturals Extra Strength Hip & Joint Tablets",NULL,"39.9900","Dog Supplement","Pet Naturals","0.0000",NULL,"0",NULL,NULL,"Joint"
"605","PureFish Oil Plus Liquid Supplement",NULL,"27.9900","Dog Supplement","PureFish","0.0000",NULL,"0",NULL,NULL,"Omegas"
"606","WellnessCore Probiotic Digestive Aid Soft Chews",NULL,"28.9900","Dog Supplement","WellnessCore","0.0000",NULL,"0",NULL,NULL,"Probiotic"
"607","ActiveLife Multivitamin & Mineral Supplement Chews",NULL,"31.9900","Dog Supplement","ActiveLife","0.0000",NULL,"0",NULL,NULL,"Multivitamin"
"608","VitalCoat Skin & Coat Salmon Oil Soft Chews",NULL,"26.4900","Dog Supplement","VitalCoat","0.0000",NULL,"0",NULL,NULL,"Omegas"
"609","SeniorPlus Joint & Mobility Soft Chews",NULL,"44.4900","Dog Supplement","SeniorPlus","0.0000",NULL,"0",NULL,NULL,"Joint"
"610","Glucos-Aid Glucosamine & MSM Hip Care Tablets",NULL,"30.9900","Dog Supplement","Glucos-Aid","0.0000",NULL,"0",NULL,NULL,"Joint"
"611","ProBioMax Probiotic + Prebiotic Digestive Supplement",NULL,"22.4900","Dog Supplement","ProBioMax","0.0000",NULL,"0",NULL,NULL,"Probiotic"
"612","NutriJoint Mobility Soft Chews",NULL,"35.9900","Dog Supplement","NutriJoint","0.0000",NULL,"0",NULL,NULL,"Joint"
"613","SalmonSkin Omega Oil Liquid Supplement",NULL,"24.9900","Dog Supplement","SalmonSkin","0.0000",NULL,"0",NULL,NULL,"Omegas"
"614","Hip & Joint Care Chews for Large Breeds",NULL,"41.9900","Dog Supplement","LargeBreedCare","0.0000",NULL,"0",NULL,NULL,"Joint"
"615","DailyMulti Dog Vitamin & Mineral Soft Chews",NULL,"28.9900","Dog Supplement","DailyMulti","0.0000",NULL,"0",NULL,NULL,"Multivitamin"
"616","Coat & Skin Shine Oil Capsules",NULL,"25.4900","Dog Supplement","CoatShine","0.0000",NULL,"0",NULL,NULL,"Skin and Coat"
"617","Brain & Vision Support DHA Soft Chews",NULL,"32.9900","Dog Supplement","BrainVision","0.0000",NULL,"0",NULL,NULL,"Omegas"
"618","DigestEase Probiotic + Enzyme Digestive Support",NULL,"23.9900","Dog Supplement","DigestEase","0.0000",NULL,"0",NULL,NULL,"Probiotic"
"619","Joint & Hip Active Tablets",NULL,"34.9900","Dog Supplement","JointActive","0.0000",NULL,"0",NULL,NULL,"Joint"
"620","OceanOmega Salmon & Fish Oil Liquid Supplement",NULL,"29.9900","Dog Supplement","OceanOmega","0.0000",NULL,"0",NULL,NULL,"Omegas"
"621","Antioxidant Plus Multivitamin Soft Chews",NULL,"27.9900","Dog Supplement","AntioxPet","0.0000",NULL,"0",NULL,NULL,"Multivitamin"
"622","MoodCalm Calming & Anxiety Relief Chews",NULL,"21.4900","Dog Supplement","MoodCalm","0.0000",NULL,"0",NULL,NULL,"Calming"
"623","Senior Gut & Joint Care Soft Chews",NULL,"46.9900","Dog Supplement","SeniorGutJoint","0.0000",NULL,"0",NULL,NULL,"Joint"
"624","ProJoint Advanced Glucosamine Tablets",NULL,"38.9900","Dog Supplement","ProJoint","0.0000",NULL,"0",NULL,NULL,"Joint"
"625","Zuke's Mini Naturals Chicken Bites",NULL,"7.9900","Dog Treats","Zuke's","0.5000","Chicken","0",NULL,NULL,"Soft Treats"
"626","Zuke's Mini Naturals Beef Bites",NULL,"7.9900","Dog Treats","Zuke's","0.5000","Beef","0",NULL,NULL,"Soft Treats"
"627","Zuke's Mini Naturals Salmon Bites",NULL,"7.9900","Dog Treats","Zuke's","0.5000","Salmon","0",NULL,NULL,"Soft Treats"
"628","Zuke's Natural Calm Chicken Chews",NULL,"8.9900","Dog Treats","Zuke's","0.2500","Chicken","0",NULL,NULL,"Jerky Treats"
"629","Zuke's Natural Calm Turkey Chews",NULL,"8.9900","Dog Treats","Zuke's","0.2500","Turkey","0",NULL,NULL,"Jerky Treats"
"630","Zuke's Rabbit & Duck Flatbread Snacks",NULL,"9.9900","Dog Treats","Zuke's","0.7500","Rabbit,Duck","0",NULL,NULL,"Crunchy Treats"
"631","Zuke's Grain-Free Duck & Salmon Bites",NULL,"9.9900","Dog Treats","Zuke's","0.5000","Duck,Salmon","0",NULL,NULL,"Soft Treats"
"632","Zuke's Good Dog Jerky Chicken Strips",NULL,"10.9900","Dog Treats","Zuke's","0.7500","Chicken","0",NULL,NULL,"Jerky Treats"
"633","Zuke's Good Dog Jerky Beef Strips",NULL,"10.9900","Dog Treats","Zuke's","0.7500","Beef","0",NULL,NULL,"Jerky Treats"
"634","Zuke's Soft & Chewy Lamb Bites",NULL,"8.9900","Dog Treats","Zuke's","0.5000","Lamb","0",NULL,NULL,"Soft Treats"
"635","Zuke's Mini Naturals Peanut Butter Bites",NULL,"7.9900","Dog Treats","Zuke's","0.5000","Peanut Butter","1",NULL,NULL,"Soft Treats"
"636","Zuke's Mini Naturals Sweet Potato Bites",NULL,"7.9900","Dog Treats","Zuke's","0.5000","Sweet Potato","1",NULL,NULL,"Soft Treats"
"637","Zuke's Wild Bites Venison",NULL,"9.9900","Dog Treats","Zuke's","0.5000","Venison","0",NULL,NULL,"Soft Treats"
"638","Zuke's Wild Bites Salmon",NULL,"9.9900","Dog Treats","Zuke's","0.5000","Salmon","0",NULL,NULL,"Soft Treats"
"639","Zuke's Mini Naturals Lamb Bites",NULL,"7.9900","Dog Treats","Zuke's","0.5000","Lamb","0",NULL,NULL,"Soft Treats"
"640","Zuke's Good Dog Jerky Turkey Strips",NULL,"10.9900","Dog Treats","Zuke's","0.7500","Turkey","0",NULL,NULL,"Jerky Treats"
"641","Zuke's Good Dog Jerky Salmon Strips",NULL,"10.9900","Dog Treats","Zuke's","0.7500","Salmon","0",NULL,NULL,"Jerky Treats"
"642","Zuke's Mini Naturals Rabbit Bites",NULL,"7.9900","Dog Treats","Zuke's","0.5000","Rabbit","0",NULL,NULL,"Soft Treats"
"643","Zuke's Mini Naturals Chicken & Cheese Bites",NULL,"7.9900","Dog Treats","Zuke's","0.5000","Chicken,Cheese","0",NULL,NULL,"Soft Treats"
"644","Zuke's Mini Naturals Peanut Butter & Banana Bites",NULL,"7.9900","Dog Treats","Zuke's","0.5000","Peanut Butter,Banana","1",NULL,NULL,"Soft Treats"
"645","Blue Buffalo Health Bars Chicken & Oats",NULL,"13.9900","Dog Treats","Blue Buffalo","0.6000","Chicken","0",NULL,NULL,"Crunchy Treats"
"646","Blue Buffalo Health Bars Beef & Brown Rice",NULL,"13.9900","Dog Treats","Blue Buffalo","0.6000","Beef","0",NULL,NULL,"Crunchy Treats"
"647","Blue Buffalo Wilderness Trail Treats Chicken",NULL,"14.9900","Dog Treats","Blue Buffalo","0.7000","Chicken","0",NULL,NULL,"Crunchy Treats"
"648","Blue Buffalo Wilderness Trail Treats Turkey",NULL,"14.9900","Dog Treats","Blue Buffalo","0.7000","Turkey","0",NULL,NULL,"Crunchy Treats"
"649","Blue Buffalo Wilderness Trail Treats Salmon",NULL,"14.9900","Dog Treats","Blue Buffalo","0.7000","Salmon","0",NULL,NULL,"Crunchy Treats"
"650","Blue Buffalo Wilderness Trail Treats Lamb",NULL,"14.9900","Dog Treats","Blue Buffalo","0.7000","Lamb","0",NULL,NULL,"Crunchy Treats"
"651","Blue Buffalo Wilderness Trail Treats Duck",NULL,"14.9900","Dog Treats","Blue Buffalo","0.7000","Duck","0",NULL,NULL,"Crunchy Treats"
"652","Blue Buffalo Wilderness Jerky Chicken Strips",NULL,"15.9900","Dog Treats","Blue Buffalo","0.8000","Chicken","0",NULL,NULL,"Jerky Treats"
"653","Blue Buffalo Wilderness Jerky Beef Strips",NULL,"15.9900","Dog Treats","Blue Buffalo","0.8000","Beef","0",NULL,NULL,"Jerky Treats"
"654","Blue Buffalo Wilderness Jerky Salmon Strips",NULL,"15.9900","Dog Treats","Blue Buffalo","0.8000","Salmon","0",NULL,NULL,"Jerky Treats"
"655","Blue Buffalo Health Bars Lamb & Brown Rice",NULL,"13.9900","Dog Treats","Blue Buffalo","0.6000","Lamb","0",NULL,NULL,"Crunchy Treats"
"656","Blue Buffalo Health Bars Salmon & Brown Rice",NULL,"13.9900","Dog Treats","Blue Buffalo","0.6000","Salmon","0",NULL,NULL,"Crunchy Treats"
"657","Blue Buffalo Health Bars Turkey & Brown Rice",NULL,"13.9900","Dog Treats","Blue Buffalo","0.6000","Turkey","0",NULL,NULL,"Crunchy Treats"
"658","Blue Buffalo Health Bars Duck & Brown Rice",NULL,"13.9900","Dog Treats","Blue Buffalo","0.6000","Duck","0",NULL,NULL,"Crunchy Treats"
"659","Blue Buffalo Health Bars Venison & Brown Rice",NULL,"13.9900","Dog Treats","Blue Buffalo","0.6000","Venison","0",NULL,NULL,"Crunchy Treats"
"660","Blue Buffalo Wilderness Trail Treats Venison",NULL,"14.9900","Dog Treats","Blue Buffalo","0.7000","Venison","0",NULL,NULL,"Crunchy Treats"
"661","Blue Buffalo Wilderness Jerky Turkey Strips",NULL,"15.9900","Dog Treats","Blue Buffalo","0.8000","Turkey","0",NULL,NULL,"Jerky Treats"
"662","Blue Buffalo Wilderness Jerky Lamb Strips",NULL,"15.9900","Dog Treats","Blue Buffalo","0.8000","Lamb","0",NULL,NULL,"Jerky Treats"
"663","Blue Buffalo Wilderness Jerky Duck Strips",NULL,"15.9900","Dog Treats","Blue Buffalo","0.8000","Duck","0",NULL,NULL,"Jerky Treats"
"664","Blue Buffalo Wilderness Jerky Venison Strips",NULL,"15.9900","Dog Treats","Blue Buffalo","0.8000","Venison","0",NULL,NULL,"Jerky Treats"
"665","Wellness Soft Puppy Bites Chicken",NULL,"14.9900","Dog Treats","Wellness","0.5000","Chicken","0",NULL,NULL,"Soft Treats"
"666","Wellness Soft Puppy Bites Turkey",NULL,"14.9900","Dog Treats","Wellness","0.5000","Turkey","0",NULL,NULL,"Soft Treats"
"667","Wellness CORE Grain-Free Chicken Treats",NULL,"16.9900","Dog Treats","Wellness","0.6000","Chicken","0",NULL,NULL,"Soft Treats"
"668","Wellness CORE Grain-Free Beef Treats",NULL,"16.9900","Dog Treats","Wellness","0.6000","Beef","0",NULL,NULL,"Soft Treats"
"669","Wellness CORE Grain-Free Salmon Treats",NULL,"16.9900","Dog Treats","Wellness","0.6000","Salmon","0",NULL,NULL,"Soft Treats"
"670","Wellness CORE Grain-Free Turkey Treats",NULL,"16.9900","Dog Treats","Wellness","0.6000","Turkey","0",NULL,NULL,"Soft Treats"
"671","Wellness Soft Puppy Bites Lamb",NULL,"14.9900","Dog Treats","Wellness","0.5000","Lamb","0",NULL,NULL,"Soft Treats"
"672","Wellness Soft Puppy Bites Duck",NULL,"14.9900","Dog Treats","Wellness","0.5000","Duck","0",NULL,NULL,"Soft Treats"
"673","Wellness Complete Health Veggie & Salmon Treats",NULL,"12.9900","Dog Treats","Wellness","0.5500","Salmon","0",NULL,NULL,"Soft Treats"
"674","Wellness Complete Health Peanut Butter & Banana Treats",NULL,"12.9900","Dog Treats","Wellness","0.5500","Peanut Butter,Banana","1",NULL,NULL,"Soft Treats"
"675","Wellness CORE Grain-Free Venison Treats",NULL,"16.9900","Dog Treats","Wellness","0.6000","Venison","0",NULL,NULL,"Soft Treats"
"676","Wellness CORE Grain-Free Lamb Treats",NULL,"16.9900","Dog Treats","Wellness","0.6000","Lamb","0",NULL,NULL,"Soft Treats"
"677","Wellness CORE Grain-Free Duck Treats",NULL,"16.9900","Dog Treats","Wellness","0.6000","Duck","0",NULL,NULL,"Soft Treats"
"678","Wellness Soft Puppy Bites Salmon",NULL,"14.9900","Dog Treats","Wellness","0.5000","Salmon","0",NULL,NULL,"Soft Treats"
"679","Wellness CORE Grain-Free Rabbit Treats",NULL,"16.9900","Dog Treats","Wellness","0.6000","Rabbit","0",NULL,NULL,"Soft Treats"
"680","Wellness Soft Puppy Bites Venison",NULL,"14.9900","Dog Treats","Wellness","0.5000","Venison","0",NULL,NULL,"Soft Treats"
"681","Wellness Soft Puppy Bites Turkey & Duck",NULL,"14.9900","Dog Treats","Wellness","0.5000","Turkey,Duck","0",NULL,NULL,"Soft Treats"
"682","Wellness CORE Grain-Free Chicken & Duck Treats",NULL,"16.9900","Dog Treats","Wellness","0.6000","Chicken,Duck","0",NULL,NULL,"Soft Treats"
"683","Wellness Soft Puppy Bites Lamb & Salmon",NULL,"14.9900","Dog Treats","Wellness","0.5000","Lamb,Salmon","0",NULL,NULL,"Soft Treats"
"684","Wellness Soft Puppy Bites Beef & Venison",NULL,"14.9900","Dog Treats","Wellness","0.5000","Beef,Venison","0",NULL,NULL,"Soft Treats"
"685","Merrick Power Bites Chicken",NULL,"12.9900","Dog Treats","Merrick","0.5000","Chicken","0",NULL,NULL,"Soft Treats"
"686","Merrick Power Bites Beef",NULL,"12.9900","Dog Treats","Merrick","0.5000","Beef","0",NULL,NULL,"Soft Treats"
"687","Merrick Power Bites Salmon",NULL,"12.9900","Dog Treats","Merrick","0.5000","Salmon","0",NULL,NULL,"Soft Treats"
"688","Merrick Power Bites Turkey",NULL,"12.9900","Dog Treats","Merrick","0.5000","Turkey","0",NULL,NULL,"Soft Treats"
"689","Merrick Power Bites Lamb",NULL,"12.9900","Dog Treats","Merrick","0.5000","Lamb","0",NULL,NULL,"Soft Treats"
"690","Merrick Power Bites Duck",NULL,"12.9900","Dog Treats","Merrick","0.5000","Duck","0",NULL,NULL,"Soft Treats"
"691","Merrick Power Bites Venison",NULL,"12.9900","Dog Treats","Merrick","0.5000","Venison","0",NULL,NULL,"Soft Treats"
"692","Merrick Grain-Free Beef Jerky Strips",NULL,"13.9900","Dog Treats","Merrick","0.7500","Beef","0",NULL,NULL,"Jerky Treats"
"693","Merrick Grain-Free Chicken Jerky Strips",NULL,"13.9900","Dog Treats","Merrick","0.7500","Chicken","0",NULL,NULL,"Jerky Treats"
"694","Merrick Grain-Free Salmon Jerky Strips",NULL,"13.9900","Dog Treats","Merrick","0.7500","Salmon","0",NULL,NULL,"Jerky Treats"
"695","Merrick Grain-Free Turkey Jerky Strips",NULL,"13.9900","Dog Treats","Merrick","0.7500","Turkey","0",NULL,NULL,"Jerky Treats"
"696","Merrick Grain-Free Lamb Jerky Strips",NULL,"13.9900","Dog Treats","Merrick","0.7500","Lamb","0",NULL,NULL,"Jerky Treats"
"697","Merrick Grain-Free Duck Jerky Strips",NULL,"13.9900","Dog Treats","Merrick","0.7500","Duck","0",NULL,NULL,"Jerky Treats"
"698","Merrick Grain-Free Venison Jerky Strips",NULL,"13.9900","Dog Treats","Merrick","0.7500","Venison","0",NULL,NULL,"Jerky Treats"
"699","Merrick Backcountry Beef & Bison Treats",NULL,"14.9900","Dog Treats","Merrick","0.6000","Beef,Bison","0",NULL,NULL,"Soft Treats"
"700","Merrick Backcountry Chicken & Salmon Treats",NULL,"14.9900","Dog Treats","Merrick","0.6000","Chicken,Salmon","0",NULL,NULL,"Soft Treats"
"701","Merrick Backcountry Lamb & Venison Treats",NULL,"14.9900","Dog Treats","Merrick","0.6000","Lamb,Venison","0",NULL,NULL,"Soft Treats"
"702","Merrick Backcountry Duck & Turkey Treats",NULL,"14.9900","Dog Treats","Merrick","0.6000","Duck,Turkey","0",NULL,NULL,"Soft Treats"
"703","Merrick Backcountry Rabbit & Salmon Treats",NULL,"14.9900","Dog Treats","Merrick","0.6000","Rabbit,Salmon","0",NULL,NULL,"Soft Treats"
"704","Merrick Backcountry Pork & Chicken Treats",NULL,"14.9900","Dog Treats","Merrick","0.6000","Pork,Chicken","0",NULL,NULL,"Soft Treats"
"705","Merrick Grain-Free Duck Liver Treats",NULL,"12.9900","Dog Treats","Merrick","0.5000","Duck","0",NULL,NULL,"Soft Treats"
"706","Merrick Grain-Free Beef Liver Treats",NULL,"12.9900","Dog Treats","Merrick","0.5000","Beef","0",NULL,NULL,"Soft Treats"
"707","Merrick Grain-Free Chicken Liver Treats",NULL,"12.9900","Dog Treats","Merrick","0.5000","Chicken","0",NULL,NULL,"Soft Treats"
"708","Merrick Grain-Free Salmon Skin Treats",NULL,"12.9900","Dog Treats","Merrick","0.5000","Salmon","0",NULL,NULL,"Soft Treats"
"709","Merrick Grain-Free Turkey Liver Treats",NULL,"12.9900","Dog Treats","Merrick","0.5000","Turkey","0",NULL,NULL,"Soft Treats"
"710","Merrick Grain-Free Lamb Liver Treats",NULL,"12.9900","Dog Treats","Merrick","0.5000","Lamb","0",NULL,NULL,"Soft Treats"
"711","Merrick Grain-Free Venison Liver Treats",NULL,"12.9900","Dog Treats","Merrick","0.5000","Venison","0",NULL,NULL,"Soft Treats"
"712","Merrick Grain-Free Rabbit Liver Treats",NULL,"12.9900","Dog Treats","Merrick","0.5000","Rabbit","0",NULL,NULL,"Soft Treats"
"713","Merrick Grain-Free Duck & Sweet Potato Treats",NULL,"12.9900","Dog Treats","Merrick","0.5500","Duck","0",NULL,NULL,"Soft Treats"
"714","Merrick Grain-Free Chicken & Sweet Potato Treats",NULL,"12.9900","Dog Treats","Merrick","0.5500","Chicken","0",NULL,NULL,"Soft Treats"
"715","Merrick Grain-Free Beef & Sweet Potato Treats",NULL,"12.9900","Dog Treats","Merrick","0.5500","Beef","0",NULL,NULL,"Soft Treats"
"716","Merrick Grain-Free Salmon & Sweet Potato Treats",NULL,"12.9900","Dog Treats","Merrick","0.5500","Salmon","0",NULL,NULL,"Soft Treats"
"717","Merrick Grain-Free Turkey & Sweet Potato Treats",NULL,"12.9900","Dog Treats","Merrick","0.5500","Turkey","0",NULL,NULL,"Soft Treats"
"718","Merrick Grain-Free Lamb & Sweet Potato Treats",NULL,"12.9900","Dog Treats","Merrick","0.5500","Lamb","0",NULL,NULL,"Soft Treats"
"719","Merrick Grain-Free Venison & Sweet Potato Treats",NULL,"12.9900","Dog Treats","Merrick","0.5500","Venison","0",NULL,NULL,"Soft Treats"
"720","Merrick Grain-Free Rabbit & Sweet Potato Treats",NULL,"12.9900","Dog Treats","Merrick","0.5500","Rabbit","0",NULL,NULL,"Soft Treats"
"721","Merrick Backcountry Beef & Venison Jerky",NULL,"15.9900","Dog Treats","Merrick","0.7500","Beef,Venison","0",NULL,NULL,"Jerky Treats"
"722","Merrick Backcountry Chicken & Duck Jerky",NULL,"15.9900","Dog Treats","Merrick","0.7500","Chicken,Duck","0",NULL,NULL,"Jerky Treats"
"723","Merrick Backcountry Lamb & Rabbit Jerky",NULL,"15.9900","Dog Treats","Merrick","0.7500","Lamb,Rabbit","0",NULL,NULL,"Jerky Treats"
"724","Merrick Backcountry Salmon & Turkey Jerky",NULL,"15.9900","Dog Treats","Merrick","0.7500","Salmon,Turkey","0",NULL,NULL,"Jerky Treats"
"725","Merrick Grain-Free Duck Liver Jerky",NULL,"15.9900","Dog Treats","Merrick","0.7500","Duck","0",NULL,NULL,"Jerky Treats"
"726","Merrick Grain-Free Beef Liver Jerky",NULL,"15.9900","Dog Treats","Merrick","0.7500","Beef","0",NULL,NULL,"Jerky Treats"
"727","Merrick Grain-Free Chicken Liver Jerky",NULL,"15.9900","Dog Treats","Merrick","0.7500","Chicken","0",NULL,NULL,"Jerky Treats"
"728","Merrick Grain-Free Salmon Skin Jerky",NULL,"15.9900","Dog Treats","Merrick","0.7500","Salmon","0",NULL,NULL,"Jerky Treats"
"729","Merrick Grain-Free Turkey Liver Jerky",NULL,"15.9900","Dog Treats","Merrick","0.7500","Turkey","0",NULL,NULL,"Jerky Treats"
"730","Merrick Grain-Free Lamb Liver Jerky",NULL,"15.9900","Dog Treats","Merrick","0.7500","Lamb","0",NULL,NULL,"Jerky Treats"
"731","Merrick Grain-Free Venison Liver Jerky",NULL,"15.9900","Dog Treats","Merrick","0.7500","Venison","0",NULL,NULL,"Jerky Treats"
"732","Merrick Grain-Free Rabbit Liver Jerky",NULL,"15.9900","Dog Treats","Merrick","0.7500","Rabbit","0",NULL,NULL,"Jerky Treats"
"733","Merrick Backcountry Beef & Venison Bites",NULL,"14.9900","Dog Treats","Merrick","0.6000","Beef,Venison","0",NULL,NULL,"Soft Treats"
"734","Merrick Backcountry Chicken & Duck Bites",NULL,"14.9900","Dog Treats","Merrick","0.6000","Chicken,Duck","0",NULL,NULL,"Soft Treats"
"735","Merrick Backcountry Lamb & Rabbit Bites",NULL,"14.9900","Dog Treats","Merrick","0.6000","Lamb,Rabbit","0",NULL,NULL,"Soft Treats"
"736","Merrick Backcountry Salmon & Turkey Bites",NULL,"14.9900","Dog Treats","Merrick","0.6000","Salmon,Turkey","0",NULL,NULL,"Soft Treats"
"737","Merrick Grain-Free Duck Liver Bites",NULL,"12.9900","Dog Treats","Merrick","0.5000","Duck","0",NULL,NULL,"Soft Treats"
"738","Merrick Grain-Free Beef Liver Bites",NULL,"12.9900","Dog Treats","Merrick","0.5000","Beef","0",NULL,NULL,"Soft Treats"
"739","Merrick Grain-Free Chicken Liver Bites",NULL,"12.9900","Dog Treats","Merrick","0.5000","Chicken","0",NULL,NULL,"Soft Treats"
"740","Merrick Grain-Free Salmon Skin Bites",NULL,"12.9900","Dog Treats","Merrick","0.5000","Salmon","0",NULL,NULL,"Soft Treats"
"741","Merrick Grain-Free Turkey Liver Bites",NULL,"12.9900","Dog Treats","Merrick","0.5000","Turkey","0",NULL,NULL,"Soft Treats"
"742","Merrick Grain-Free Lamb Liver Bites",NULL,"12.9900","Dog Treats","Merrick","0.5000","Lamb","0",NULL,NULL,"Soft Treats"
"743","Merrick Grain-Free Venison Liver Bites",NULL,"12.9900","Dog Treats","Merrick","0.5000","Venison","0",NULL,NULL,"Soft Treats"
"744","Merrick Grain-Free Rabbit Liver Bites",NULL,"12.9900","Dog Treats","Merrick","0.5000","Rabbit","0",NULL,NULL,"Soft Treats"
"745","Pup-Peroni Training Treats 5.6 oz Bag",NULL,"6.9900","Dog Treats","Pup-Peroni","0.3500","Beef","1",NULL,NULL,"Soft Treats"
"746","Pup-Peroni Training Treats 5.6 oz Bag",NULL,"6.9900","Dog Treats","Pup-Peroni","0.3500","Chicken","1",NULL,NULL,"Soft Treats"
"747","Pup-Peroni Grain‑Free Turkey Jerky 3 oz",NULL,"7.4900","Dog Treats","Pup-Peroni","0.1900","Turkey","0",NULL,NULL,"Jerky Treats"
"748","Pup-Peroni Grain‑Free Salmon Jerky 3 oz",NULL,"7.9900","Dog Treats","Pup-Peroni","0.1900","Salmon","0",NULL,NULL,"Jerky Treats"
